cluster,posts,avg_engagement,total_engagement,dominant_topic,first_seen,last_seen,keywords
11,404,4374.9,1767450,worldnews,2026-03-25 12:44:44,2026-04-24 06:04:23,"iran, hormuz, strait, strait hormuz, trump, war, iran war, says"
9,181,3406.5,616571,worldnews,2026-03-25 10:44:43,2026-04-24 08:22:44,"ukraine, russian, russia, hungary, election, oil, eu, magyar"
23,506,628.4,317965,movies,2026-03-25 14:25:38,2026-04-24 08:00:39,"movie, game, like, movies, just, games, really, time"
17,88,2593.4,228215,technology,2026-03-25 12:55:00,2026-04-23 19:21:25,"ai, startup, generated, ai generated, says, powered, future, revenue"
5,49,3758.2,184151,technology,2026-03-25 09:20:08,2026-04-24 06:49:50,"data, centers, data centers, data center, center, ai, ai data, half"
7,61,2877.3,175518,movies,2026-03-25 15:08:06,2026-04-23 22:07:59,"poster, official poster, official, new poster, new, theaters, starring, anniversary"
0,88,1838.9,161827,technology,2026-03-25 13:23:23,2026-04-22 21:12:59,"social, social media, media, ban, media ban, government, people, addiction"
20,69,2178.9,150343,science,2026-03-25 10:14:56,2026-04-24 06:40:05,"study, study finds, finds, associated, risk, analysis, new study, sleep"
21,49,2673.5,131001,science,2026-03-26 04:23:12,2026-04-23 17:17:29,"brain, scientists, cancer, shows, research, research shows, function, cells"
6,69,1535.4,105941,movies,2026-03-25 15:01:58,2026-04-24 08:08:25,"trailer, official, official trailer, official teaser, theaters, teaser, 2026, june"
4,30,3454.9,103646,worldnews,2026-03-26 12:59:13,2026-04-22 12:09:40,"military, airspace, iran, prepares, eastern, pacific, says, denies"
1,58,1686.1,97792,technology,2026-03-27 12:26:58,2026-04-23 23:12:57,"microsoft, windows, windows 11, 11, copilot, xbox, game pass, xbox game"
3,32,2729.4,87340,movies,2026-03-26 11:44:35,2026-04-23 19:02:01,"warner, warner bros, bros, paramount, discovery, merger, paramount warner, bros discovery"
19,32,2420.0,77439,technology,2026-03-25 15:49:58,2026-04-24 06:40:02,"new, new york, york, spaceballs, change, reveals, treat, engine"
22,55,1318.1,72493,movies,2026-03-25 12:07:47,2026-04-24 02:17:22,"com, www, https www, https, poll, reddit, www reddit, reddit com"
12,50,1284.2,64209,worldnews,2026-03-27 21:46:24,2026-04-24 07:17:15,"china, taiwan, opposition leader, opposition, leader, sea, visit, philippines"
10,73,829.1,60527,technology,2026-03-27 04:39:48,2026-04-23 18:15:10,"anthropic, claude, mythos, code, model, ai, ai model, anthropic mythos"
15,60,930.9,55854,movies,2026-03-25 21:47:26,2026-04-24 02:41:46,"directed, scene, scene directed, dir, 2000, 2012, 2007, starring"
2,59,842.7,49720,worldnews,2026-03-27 03:42:12,2026-04-24 03:27:23,"japan, korea, north korea, south, north, south korea, south africa, arms"
18,30,1506.6,45197,technology,2026-03-26 01:05:51,2026-04-23 01:57:25,"meta, glasses, smart, smart glasses, ai, train ai, employee, ray"
8,38,1090.2,41427,technology,2026-03-25 08:56:14,2026-04-24 04:56:24,"openai, chatgpt, anthropic, florida, shooting, probe, criminal, ai"
16,49,570.7,27964,movies,2026-03-25 16:28:06,2026-04-24 00:12:23,"amp, ama, amp announcement, ama amp, pm et, et, announcement, pm"
14,79,107.3,8476,smartphones,2026-03-25 12:15:34,2026-04-23 23:17:59,"phone, good, camera, buy, battery, good camera, looking, best"
13,136,23.3,3167,smartphones,2026-03-25 11:11:32,2026-04-24 05:37:18,"pro, iphone, ultra, 17, s26, iphone 17, pro max, phone"
